{
  "schema": "howlplane.test_impact_assessment/v1",
  "changed_behavior": "New opt-in deterministic component-suite runner records actual bounded subprocess exits and source fingerprints; refuses source-output collisions, source changes, stale receipts, invalid deadlines and surviving background processes. No existing production orchestration or approval path is changed.",
  "tests_added": [
    "tests/test_operational_proof_runner.py (20 behavioral cases)"
  ],
  "tests_updated": [],
  "tests_removed": [],
  "duplicate_or_obsolete_tests_reviewed": true,
  "full_regression_required": true,
  "regression_commands_run": [
    "PYTHONPATH=src:. python -m pytest -q tests/test_operational_proof_runner.py",
    "PATH=/home/linuxbrew/.linuxbrew/bin:$PATH HOWLFRAME_ARTIFACT_COMPILER_BIN=/run/media/system/tallgeese/dev/operational_missions/frame_v010/howlframe PYTHONPATH=src:. make test-full",
    "python -m flake8 scripts/run_operational_proof.py tests/test_operational_proof_runner.py --count --select=E9,F63,F7,F82 --show-source --statistics",
    "python -m flake8 scripts/run_operational_proof.py tests/test_operational_proof_runner.py --count --exit-zero --max-complexity=10 --max-line-length=127 --statistics"
  ],
  "rationale": "New opt-in test tooling needs direct failed-command, timeout, source mutation and authority-adjacent evidence coverage, not duplicate application logic tests. Independent review found source overwrite and orphan-child counterexamples, now protected by regression cases. Final full gate exits0 with2656 passed,1 skipped,3 deselected and1 external ChromaDB deprecation warning; Go tests pass. This warning prevents a clean completion claim under local policy. No warnings were suppressed or tests weakened. Receipts are unauthenticated observations, never protected approval. The repository CI fatal Flake8 gate and its127-column advisory invocation both returned0 with zero findings. A bare unconfigured79-column exploration emitted E501 style diagnostics; it is not the repository configured gate."
}
